{
  "schema": "matrixscroll.identity_certificate.v1",
  "subject": {
    "public_key": "CWznv6HLNBD8DyLjO9qexegHccGAq99V/nwkN3gRLTA=",
    "device_id": "MS-562F-0D25",
    "display_name": "Mallory",
    "verified_accounts": [
      {
        "type": "github",
        "value": "ssx360",
        "method": "oauth"
      },
      {
        "type": "email",
        "value": "ryan@matrixscroll.com",
        "method": "oauth"
      }
    ],
    "plan": "basic",
    "issued_at": "2026-06-27T04:19:25Z",
    "expires_at": "2026-07-27T04:19:25Z"
  },
  "issuer": {
    "authority": "matrixscroll-authority-v1",
    "public_key": "bsVoWgUYK+NZNcSNIoWjO3IiTK/xT6U6mXFzBJgPUKc=",
    "device_id": "MS-4319-20D5"
  },
  "signature": {
    "schema": "matrixscroll.signature.v1",
    "algorithm": "ed25519",
    "device_id": "MS-4319-20D5",
    "public_key": "bsVoWgUYK+NZNcSNIoWjO3IiTK/xT6U6mXFzBJgPUKc=",
    "mode": "emulated",
    "signed_at": "2026-06-27T04:19:25Z",
    "value": "7ZzBREnZRWHPKaluyyAe2yW1RjBQVq7CDOgDaEdcqKUC+t/Kop9p1TIHVpNIIlxh3YEbCIPBkCEgIfZGsr3lAA=="
  }
}